theorem,NL,FL
le_total,"The goal is now to prove that x + (e + 1) = x + (e + 1), which is true by reflexivity.",rfl
le_total,"We consider the case where d is less than or equal to x. We then break down this case into two subcases: one where x is equal to d plus some natural number e, and the other where x is greater than d by some natural number e.",cases h2 with e he
le_total,We consider the cases that e is zero or the successor of a natural number a.,cases e with a
le_total,"We substitute x with d + 0 in the goal, resulting in the the goal d + 0 ≤ succ d ∨ succ d ≤ d + 0.",rw [he]
le_total,"We choose to prove the left side of the disjunction, which is d + 0 ≤ succ d.",left
le_total,We rewrite the left-hand side of the goal to d because d + 0 = d.,rw [add_zero]
le_total,We use the case of 1 to simplify the goal to succ d = d + 1.,use 1
le_total,"The goal is to prove that succ d equals d + 1. We directly apply the fact that the successor of a natural number d is equal to d + 1, which completes the proof for this goal.",exact succ_eq_add_one d
le_total,"We choose to prove the right side of the disjunction, which is succ d <= x.",right
le_total,We use the case of a to rewrite the goal to succ x = succ d + a.,use a
le_total,The goal is to prove that succ d equals d + 1. We directly apply the fact that the successor of a natural number d is equal to d + 1.,rw [add_succ] at he
le_total,Rewrite the right hand side of the goal using the theorem that adding a successor to a natural number is the same as adding the natural number and then taking the successor. This leaves the goal unchanged in this case.,rw [succ_add]
le_total,"We have shows that x = succ d + a, so we can use this to prove the goal.",exact he
succ_le_succ,"Prove that if the successor of x is less than or equal to the successor of y, then x is less than or equal to y.",theorem succ_le_succ (x y : ℕ) (hx : succ x ≤ succ y) : x ≤ y := by
succ_le_succ,We consider the case where the successor of x is less than or equal to the successor of y. This implies that the successor of y is equal to the successor of x plus some natural number d.,cases hx with d hd
succ_le_succ,We assume d as the difference such that when added to x results in y. The goal now is to prove that y is equal to x plus d.,use d
succ_le_succ,We rewrite the right-hand side of succ y = succ x + d using the theorem that states the the successor of a sum of two natural numbers is the same as the successor of the first number added to the second number.,rw [succ_add] at hd
succ_le_succ,"We apply the property that if two natural numbers with successors are equal, then the original numbers are also equal.",apply succ_inj at hd
succ_le_succ,"We have shown that x = y + d, so we can use this to prove the goal.",exact hd
le_one,"Prove that if x is less than or equal to 1, then x is equal to 0 or 1.",theorem le_one (x : ℕ) (hx : x ≤ 1) : x = 0 ∨ x = 1 := by
le_one,"We consider the case where x is a natural number. We then break down this case into two subcases: one where x is equal to 0, and the other where x is equal to the successor of another natural number y.",cases x with y
le_one,"We choose to prove the left side of the disjunction, which is 0 = 0.",left
le_one,"We are given that 0 equals 0, so we can use reflexivity to prove the goal.",rfl
le_one,"Replace 1 with the successor of 0. This means we are given that the succ y <= succ 0, and the updated goal is that the succ y = 0 or the succ y = succ 0.",rw [one_eq_succ_zero] at hx ⊢
le_one,"We use the property that if one natural number is less than or equal to another, then their successors also maintain this relationship. This means that y <= 0.",apply succ_le_succ at hx
le_one,"We apply the property that if x is less than or equal to 0, then x must be equal to 0 so y = 0.",apply le_zero at hx
le_one,"We substitute y with 0 in the goal, resulting in the goal succ 0 = 0 ∨ succ 0 = succ 0.",rw [hx]
le_one,"We choose to prove the right side of the disjunction, which is succ 0 = succ 0.",right
le_one,"We are given that succ 0 equals succ 0, so we can use reflexivity to prove the goal.",rfl
le_two,"Prove that if x is less than or equal to 2, then x is equal to 0, 1, or 2.",theorem le_two (x : ℕ) (hx : x ≤ 2) : x = 0 ∨ x = 1 ∨ x = 2 := by
le_two,"We consider the case where x is a natural number. We then break down this case into two subcases: one where x is equal to 0, and the other where x is equal to the successor of another natural number y.",cases x with y
le_two,"We choose to prove the left side of the disjunction, which is 0 = 0.",left
le_two,"We are given that 0 equals 0, so we can use reflexivity to prove the goal.",rfl
le_two,"We consider the case where y is a natural number. We then break down this case into two subcases: one where y is equal to 0, and the other where y is equal to the successor of another natural number z.",cases y with z
le_two,"We choose to prove the right side of the disjunction, which is succ 0 = 1 ∨ succ 0 = 2.",right
le_two,"We choose to prove the left side of the disjunction, which is succ 0 = 1.",left
le_two,We rewrite the goal using the theorem that states the successor of 0 is equal to 1.,rw [one_eq_succ_zero]
le_two,"We are given that 0 equals 0, so we can use reflexivity to prove the goal.",rfl
le_two,"We rewrite the number 2 as the successor of 1, and 1 as the successor of 0. Now was know that 'succ (succ z) ≤ succ (succ 0)' and the goal to 'succ (succ z) = 0 ∨ succ (succ z) = succ 0 ∨ succ (succ z) = succ (succ 0)'.","rw [two_eq_succ_one, one_eq_succ_zero] at hx ⊢"
le_two,We simplify succ (succ z) <= succ (succ 0) to the assumption that the succ z <= succ 0.,apply succ_le_succ at hx
le_two,We simplify succ z <= succ 0 to z <= 0.,apply succ_le_succ at hx
le_two,"We apply the property that if z is less than or equal to 0, then z must be equal to 0.",apply le_zero at hx
le_two,"We substitute z with 0 in the goal, resulting in the goal succ (succ 0) = 0 ∨ succ (succ 0) = succ 0 ∨ succ (succ 0) = succ (succ 0).",rw [hx]
le_two,"We choose to prove the right side of the disjunction, which is succ (succ 0) = succ 0 ∨ succ (succ 0) = succ (succ 0).",right
le_two,"We choose to prove the right side of this disjunction, which is succ (succ 0) = succ (succ 0).",right
le_two,"We have that succ (succ 0) = succ (succ 0), so we can use reflexivity to prove the goal.",rfl
mul_one,"Prove the multiplicative identity property, the multiplication of m * 1 is m, for all natural numbers",theorem mul_one (m : ℕ) : m * 1 = m := by
mul_one,"Rewrite 1 as succ 0, using the axiom that succ 0 = 1",rw [one_eq_succ_zero]
mul_one,Rewrite LHS m * succ 0 to m * 0 + m using the definition of multiplication with a successor.,rw [mul_succ]
mul_one,Simplify m * 0 + m to 0 + m on LHS,rw [mul_zero]
mul_one,Rewrite the LHS 0 + m = m,rw [zero_add]
mul_one,"Prove LHS and RHS are equal, m = m, completing the proof",rfl
zero_mul,Prove that 0 * m = m for all natural numbers,theorem zero_mul (m : ℕ) : 0 * m = 0 := by
succ_mul,"Prove that succ a * b = a * b + b for all natural numbers a, b",theorem succ_mul (a b : ℕ) : succ a * b = a * b + b := by
succ_mul,"Induct on b, with d = 0 as the base case and the inductive hypothesis succ a * d = a * d + d. There are now two proof goals, prove base case: succ a * 0 = a * 0 + 0, and inductive step: succ a * succ d = a * succ d + succ d.",induction b with d hd
succ_mul,First we prove base case. Simplify the LHS from succ a * 0 to 0,· rw [mul_zero]
succ_mul,Simplify LHS a * 0 = 0,rw [mul_zero]
succ_mul,Simplify RHS 0 + 0 to 0,rw [add_zero]
succ_mul,"Prove LHS and RHS are equal, 0 = 0, completing base case",rfl
succ_mul,Now prove inductive step. We rewrite LHS succ a * succ d to succ a * d + succ a,· rw [mul_succ]
succ_mul,Expand the RHS from a * succ d + succ d to a * d + a + succ d,rw [mul_succ]
succ_mul,Rewrite the LHS  succ a * d + succ a to a * d + d + succ a using the inductive hypothesis,rw [hd]
succ_mul,Rewrite the LHS  a * d + d + succ a to succ (a * d + d + a),rw [add_succ]
succ_mul,"Rewrite RHS, changing a * d + a + succ d to succ (a * d + a + d)",rw [add_succ]
succ_mul,Apply  commutative property of additionin LHS: a * d + d + a to a * d + a + d,rw [add_right_comm]
succ_mul,"Prove LHS and RHS are equal, succ (a * d + a + d) = succ (a * d + a + d), completing the proof",rfl
mul_comm,"Prove that multiplication is commutative, that is a * b  = b * a for all natural numbers",theorem mul_comm (a b : ℕ) : a * b = b * a := by
mul_comm,"Induct on b, with d = 0 as the base case and the inductive hypothesis a * d = d * a. There are now two proof goals, prove base case: a * 0 = 0 * a, and inductive step: a * succ d = succ d * a.",induction b with d hd
mul_comm,First we prove base case. Simplify RHS 0 * a to 0,· rw [zero_mul]
mul_comm,Simplify LHS a * 0 to 0,rw [mul_zero]
mul_comm,"Prove LHS and RHS are equal, 0 = 0, completing base case",rfl
mul_comm,Next prove inductive step. Rewrite RHS succ d * a to d * a + a,· rw [succ_mul]
mul_comm,Rewrite the RHS from d * a + a to a * d + a using the inductive hypothesis,rw [← hd]
mul_comm,"Rewrite the LHS, changing a * succ d to a * d + a",rw [mul_succ]
mul_comm,"Prove LHS and RHS are equal, a * d + a = a * d + a, completing the proof",rfl
mul_comm_2,"Prove that multiplication is commutative, that is a * b = b * a for all natural numbers",theorem mul_comm_2 (a b : ℕ) : a * b = b * a := by
mul_comm_2,"Induct on b, with d = 0 as the base case and the inductive hypothesis a * d = d * a.",induction b with d hd
mul_comm_2,"Prove LHS and RHS are equal, 0 = 0, completing base case.",rfl
mul_comm_2,Use the inductive hypothesis within the context of addition.,rw [hd]
mul_comm_2,"Prove LHS and RHS are equal, a * d + a = a * d + a, completing the proof.",rfl
one_mul,"Prove that 1 * m = m, for all natural numbers",theorem one_mul (m : ℕ): 1 * m = m := by
one_mul,Apply the commutative property of multiplication to rewrite LHS from 1 * m to m * 1,rw [mul_comm]
one_mul,Simplify m * 1 to m,rw [mul_one]
one_mul,"Prove LHS and RHS are equal, m = m, completing the proof",rfl
one_mul_2,"Prove that 1 * m = m, for all natural numbers",theorem one_mul_2 (m : ℕ): 1 * m = m := by
one_mul_2,Apply the commutative property of multiplication to rewrite LHS from 1 * m to m * 1 and then simplify to m,"rw [mul_comm, mul_one]"
one_mul_2,"Prove LHS and RHS are equal, m = m, completing the proof",rfl
two_mul,Prove that 2 * m = m + m for all natural numbers,theorem two_mul (m : ℕ): 2 * m = m + m := by
two_mul,"Rewrite 2 as succ(1), changing LHS from 2 * m to succ 1 * m",rw [two_eq_succ_one]
two_mul,Rewrite the LHS succ 1 * m to 1 * m + m,rw [succ_mul]
two_mul,Simplify LHS from 1 * m + m to m + m by identity property of multiplication,rw [one_mul]
two_mul,"Prove LHS and RHS are equal, m + m = m + m, completing the proof",rfl
two_mul_2,Prove that 2 * m = m + m for all natural numbers,theorem two_mul_2 (m : ℕ): 2 * m = m + m := by
two_mul_2,Rewrite LHS from 2 * m to succ 1 * m and simplify to m * m using identity property of multiplication,"rw [two_eq_succ_one, succ_mul, one_mul]"
two_mul_2,"Prove LHS and RHS are equal, m + m = m + m, completing the proof",rfl
mul_add,"Prove that multiplication is distributive over addition. In other words, for all natural numbers a * (b + c) = a * b + a * c",theorem mul_add (a b c : ℕ) : a * (b + c) = a * b + a * c := by
mul_add,"Induct on b, with b = 0 as the base case and the inductive hypothesis a * b = a * b + a * c. There are now two proof goals, prove base case: a * (0 + c) = a * 0 + a * c, and inductive step: a * (succ b + c) = a * succ b + a * c",induction b with b hb
mul_add,First prove base case. Simplify LHS a * (0 + c) to a * c and RHS a * 0 + a * c to 0 + a * c and then simplify to a * c,"rw [zero_add, mul_zero, zero_add]"
mul_add,"Prove LHS and RHS are equal, a * c = a * c, completing the base case",rfl
mul_add,Next prove the inductive step. Rewrite LHS a * (succ b + c) to a * succ (b + c) and then to  a * (b + c) + a,"rw [succ_add, mul_succ]"
mul_add,Rewrite RHS from a * succ b + a * c to a * b + a + a * c and then rearrange terms to a * b + a * c + a,"rw [mul_succ, add_right_comm]"
mul_add,Rewrite the LHS a * (b + c) + a to a * b + a * c + a using the inductive hypothesis,rw [hb]
mul_add,"Prove LHS and RHS are equal, a * b + a * c + a = a * b + a * c + a, completing the proof",rfl
mul_add_2,"Prove that multiplication is distributive over addition. In other words, for all natural numbers a * (b + c) = a * b + a * c",theorem mul_add_2 (a b c : ℕ) : a * (b + c) = a * b + a * c := by
mul_add_2,"Induct on a, with a = 0 as the base case and the inductive hypothesis a * (b + c) = a * b + a * c. There are now two proof goals, prove base case: 0 * (b + c) = 0 * b + 0 * c, and inductive step: succ a * (b + c) = succ a * b + succ a * c",induction a with a ha
mul_add_2,First prove base case. Simplify LHS to 0 and RHS to 0 + 0 and then 0 by applying the rules of multiplication and addition with zero,"rw [zero_mul, zero_mul, zero_mul, zero_add]"
mul_add_2,"Prove LHS and RHS are equal, 0 = 0, completing base case",rfl
mul_add_2,Next prove inductive step. Expand LHS from succ a * (b + c) to a * (b + c) + (b + c) . Expand RHS from succ a * b + succ a * c to a * b + b + (a * c + c),"rw [succ_mul, succ_mul, succ_mul]"
mul_add_2,Rewrite LHS using the inductive hypothesis from a * (b + c) + (b + c) to a * b + a * c + (b + c),rw [ha]
mul_add_2,Apply the associative property of addition everywhere appropriate. Simplify the equation  to: a * b + a * c + (b + c) = a * b + b + (a * c + c),repeat rw [add_assoc]
mul_add_2,"Rewrite LHS by applying the associative property of addition to the term a*c, then swapping the terms b and a*c, and finally applying the associative property of addition. This results in the final equation a * b + (b + (a * c + c)) = a * b + (b + (a * c + c))","rw [← add_assoc (a*c), add_comm _ b, add_assoc]"
mul_add_2,"-- Prove LHS and RHS are equal, a * b + (b + (a * c + c)) = a * b + (b + (a * c + c)), completing inductive step",rfl
mul_add_3,"Prove that multiplication is distributive over addition. In other words, for all natural numbers a * (b + c) = a * b + a * c",theorem mul_add_3 (a b c : ℕ) : a * (b + c) = a * b + a * c := by
mul_add_3,"Induct on c, with d = 0 as the base case and the inductive hypothesis a * (b + d) = a * b + a * d. There are now two proof goals, prove base case: a * (b + 0) = a * b + a * 0, and inductive step: a * (b + succ d) = a * b + a * succ d.",induction c with d hd
mul_add_3,"First prove the base case. Simplify both sides of the equation by replacing 'b + 0' with 'b', 'a * 0' with '0', and 'a * b + 0' with 'a * b'. Now the LHS and RHS are: a * b = a * b","rw [add_zero, mul_zero, add_zero]"
mul_add_3,"Prove LHS and RHS are equal, a * b = a * b, completing base case",rfl
mul_add_3,"Next prove inductive step. Rewrite the LHS from a * (b + succ d) to a * b + a * succ d and then simplify to a * (b + d) + a. Then, rewrite a * succ d to a * d + a using the definition of multiplication with succ. Then, apply the inductive hypothesis hd to rewrite a * succ d to a * d + a. Finally, rewrite a * succ d to a * d + a and use the associative property of addition to rearrange the terms to a * b + (a * d + a).","rw [add_succ, mul_succ]"
mul_add_3,"Rewrite LHS a * b + (a * d + a), to a * b + a * d + a using the inductive hypothesis",rw [hd]
mul_add_3,Rewrite RHS a * b + a * succ d toa * b + (a * d + a) and rearrange the LHS a * b + a * d + a to a * b + (a * d + a),"rw [mul_succ, add_assoc]"
mul_add_3,"Prove LHS and RHS are equal, a * b + (a * d + a) = a * b + (a * d + a), completing base case",rfl
mul_assoc,"Prove that multiplication is associative for all natural numbers, that is (a * b) * c = a * (b * c)",theorem mul_assoc (a b c : ℕ) : (a * b) * c = a * (b * c) := by
mul_assoc,"Induct on c, with d = 0 as the base case and the inductive hypothesis a * b * d = a * (b * d). There are now two proof goals, prove base case: a * b * 0 = a * (b * 0), and inductive step: a * b * succ d = a * (b * succ d).",induction c with d hd
mul_assoc,"First prove base case. Rewrite LHS and RHS using the fact that any natural number multiplied by zero equals zero, simplifying the equation to 0 = 0","· rw [mul_zero, mul_zero, mul_zero]"
mul_assoc,"Prove LHS and RHS are equal, 0 = 0, completing base case",rfl
mul_assoc,Next prove inductive step. Rewrite LHS from a * b * succ d to a * b * d + a * b,· rw [mul_succ]
mul_assoc,Rewrite RHS from a * (b * succ d) to a * (b * d + b),rw [mul_succ]
mul_assoc,Rewrite LHS a * b * d + a * b using the inductive hypothesis to a * (b * d) + a * b,rw [hd]
mul_assoc,"Rewrite RHS using the distributive property of multiplication over addition, changing a * (b * d + b) to a * (b * d) + a * b",rw [mul_add]
mul_assoc,"Prove LHS and RHS are equal, a * (b * d) + a * b = a * (b * d) + a * b, completing base case",rfl
zero_pow_zero,Prove that 0 to the power of 0 is 1,theorem zero_pow_zero : (0 : ℕ) ^ 0 = 1 := by
zero_pow_zero,Rewrite the left-hand side of the equation using the theorem that any number to the power of 0 is 1,rw [pow_zero]
zero_pow_zero,"The goal is now to prove that 1 = 1, which is true by reflexivity",rfl
zero_pow_succ,Prove that 0^(succ m) = 0,theorem zero_pow_succ (m : ℕ) : (0 : ℕ) ^ (succ m) = 0 := by
zero_pow_succ,"Rewrite the left hand side using the identity that any natural number raised to the power of the successor of another natural number is equal to that number raised to the power of the other number, multiplied by the original number.",rw [pow_succ]
zero_pow_succ,Rewrite the left hand side using the identity that any natural number multiplied by 0 is 0,rw [mul_zero]
zero_pow_succ,"The goal is now to prove that 0 = 0, which is true by reflexivity",rfl
pow_one,Prove that a^1 = a,theorem pow_one (a : ℕ) : a ^ 1 = a  := by
pow_one,Rewrite the left hand side using the identity that 1 is equal to the successor of 0,rw [one_eq_succ_zero]
pow_one,"Rewrite the left hand side using the identity that any natural number raised to the power of the successor of another natural number is equal to that number raised to the power of the other number, multiplied by the original number.",rw [pow_succ]
pow_one,Rewrite the left hand side using the identity that any natural number to the power of 0 is 1,rw [pow_zero]
pow_one,Rewrite the left hand side using the identity that any natural number multiplied by 1 is equal to that natural number,rw [one_mul]
pow_one,"The goal is now to prove that a = a, which is true by reflexivity",rfl
one_pow,Prove that 1^m = 1,theorem one_pow (m : ℕ) : (1 : ℕ) ^ m = 1 := by
one_pow,"Induct on m, with d = 0 as the base case and the inductive hypothesis 1^d = 1. There are now two proof goals, prove base case: 1^0 = 1 and inductive step: 1^d = 1 implies 1^(succ d) = 1.",induction m with d hd
one_pow,Rewrite the left hand side using the identity that any natural number to the power of 0 is 1,rw [pow_zero]
one_pow,"The goal is now to prove that 1 = 1, which is true by reflexivity",rfl
one_pow,"Rewrite the left hand side using the identity that any natural number raised to the power of the successor of another natural number is equal to that number raised to the power of the other number, multiplied by the original number.",rw [pow_succ]
one_pow,Rewrite the left hand side using the induction hypothesis,rw [hd]
one_pow,Rewrite the left hand side using the identity that any natural number multiplied by 1 is equal to that natural number,rw [mul_one]
one_pow,"The goal is now to prove that 1 = 1, which is true by reflexivity",rfl
pow_two,Prove that a^2 = a * a,theorem pow_two (a : ℕ) : a ^ 2 = a * a := by
pow_two,Rewrite the left hand side using the identity that 2 is equal to the successor of 1,rw [two_eq_succ_one]
pow_two,"Rewrite the left hand side using the identity that any natural number raised to the power of the successor of another natural number is equal to that number raised to the power of the other number, multiplied by the original number.",rw [pow_succ]
pow_two,Rewrite the left hand side using the identity that any natural number to the power of 1 is equal to that natural number,rw [pow_one]
pow_two,"The goal is now to prove that a * a = a * a, which is true by reflexivity",rfl
pow_add,Prove that a^(m + n) = a^m * a^n,theorem pow_add (a m n : ℕ) : a ^ (m + n) = a ^ m * a ^ n := by
pow_add,"Induct on n, with d = 0 as the base case and the inductive hypothesis a^(m + d) = a^m * a^d. There are now two proof goals, prove base case: a^(m + 0) = a^m * a^0 and inductive step: a^(m + d) = a^m * a^d implies a^(m + succ d) = a^m * a^(succ d).",induction n with d hd
pow_add,Rewrite the left hand side using the identity that the sum of any natural number and 0 is equal to that natural number,rw [add_zero]
pow_add,Rewrite the left hand side using the identity that any natural number to the power of 0 is 1,rw [pow_zero]
pow_add,Rewrite the left hand side using the identity that any natural number multiplied by 1 is equal to that natural number,rw [mul_one]
pow_add,"The goal is now to prove that a^m = a^m, which is true by reflexivity",rfl
pow_add,Rewrite the left hand side using the identity that the sum of any natural number and the successor of another natural number is equal to the successor of the sum of the two natural numbers,rw [add_succ]
pow_add,"Rewrite the left hand side using the identity that any natural number raised to the power of the successor of another natural number is equal to that number raised to the power of the other number, multiplied by the original number",rw [pow_succ]
pow_add,"Rewrite the left hand side using the identity that any natural number raised to the power of the successor of another natural number is equal to that number raised to the power of the other number, multiplied by the original number",rw [pow_succ]
pow_add,Rewrite the left hand side using the induction hypothesis,rw [hd]
pow_add,Rewrite the left hand side using the identity that any natural number multiplied by the product of two natural numbers is equal to the product of the first natural number multiplied by the second natural number multiplied by the third natural number,rw [mul_assoc]
pow_add,"The goal is now to prove that a^m * (a^d * a) = a^m * a^(d + 1), which is true by reflexivity",rfl
pow_add1,Prove that a^(m + n) = a^m * a^n,theorem pow_add1 (a m n : ℕ) : a ^ (m + n) = a ^ m * a ^ n := by
pow_add1,"Induct on n, with d = 0 as the base case and the inductive hypothesis a^(m + d) = a^m * a^d. There are now two proof goals, prove base case: a^(m + 0) = a^m * a^0 and inductive step: a^(m + d) = a^m * a^d implies a^(m + succ d) = a^m * a^(succ d).",induction n with t ht
pow_add1,"Rewrite the goal by first simplifying the expression m + 0 to m, then simplifying a raised to the power of 0 to 1, and finally simplifying any number multiplied by 1 to the number itself. This results in the goal a^m = a^m.","rw [add_zero, pow_zero, mul_one]"
pow_add1,"The goal is now to prove that a^m = a^m, which is true by reflexivity",rfl
pow_add1,"Rewrite the expression a^(m + succ t) as a^m * (a^t * a) using the fact that (m + succ t) is the same as (succ (m + t)), and that a raised to the power (succ (m + t)) is the same as (a^(m + t) * a). Also, use the inductive hypothesis that a^(m + t) is equivalent to a^m * a^t, and the fact that multiplication is associative","rw [add_succ, pow_succ, pow_succ, ht, mul_assoc]"
pow_add1,"The goal is now to prove that a^m * (a^d * a) = a^m * a^(d + 1), which is true by reflexivity",rfl
mul_pow,Prove that (a * b)^n = a^n * b^n,theorem mul_pow (a b n : ℕ) : (a * b) ^ n = a ^ n * b ^ n := by
mul_pow,"Induct on n, with d = 0 as the base case and the inductive hypothesis (a * b)^d = a^d * b^d. There are now two proof goals, prove base case: (a * b)^0 = a^0 * b^0 and inductive step: (a * b)^d = a^d * b^d implies (a * b)^(succ d) = a^(succ d) * b^(succ d).",induction n with d hd
mul_pow,Rewrite the left hand side using the identity that any natural number to the power of 0 is 1,rw [pow_zero]
mul_pow,Rewrite the left hand side using the identity that any natural number to the power of 0 is 1,rw [pow_zero]
mul_pow,Rewrite the left hand side using the identity that any natural number to the power of 0 is 1,rw [pow_zero]
mul_pow,Rewrite the left hand side using the identity that any natural number multiplied by 1 is equal to that natural number,rw [mul_one]
mul_pow,"The goal is now to prove that 1 = 1, which is true by reflexivity",rfl
mul_pow,"Rewrite the left hand side using the identity that any natural number raised to the power of the successor of another natural number is equal to that number raised to the power of the other number, multiplied by the original number",rw [pow_succ]
mul_pow,"Rewrite the left hand side using the identity that any natural number raised to the power of the successor of another natural number is equal to that number raised to the power of the other number, multiplied by the original number",rw [pow_succ]
mul_pow,"Rewrite the left hand side using the identity that any natural number raised to the power of the successor of another natural number is equal to that number raised to the power of the other number, multiplied by the original number",rw [pow_succ]
mul_pow,Rewrite the left hand side using the induction hypothesis,rw [hd]
mul_pow,Rearrange the multiplication in both sides of the equation to group them in a different order using the associative property of multiplication.,repeat rw [mul_assoc]
mul_pow,"Rearrange the multiplication in the right-hand side of the equation, changing 'a * (b^d * b)' to 'b^d * b * a'",rw [mul_comm a (_ * b)]
